{
  "proto_ver": "1.0.0",
  "msg_id": "hotel-search-001",
  "ts": "2026-05-09T00:00:00Z",
  "sender": "INTERFACE_AGENT",
  "recipient": "EXECUTOR_AGENT",
  "g": "FIND_HOTEL",
  "ctx": {
    "loc": "Queenstown",
    "check_in": "2026-07-20",
    "check_out": "2026-07-25",
    "budget": 200,
    "amenities": ["wifi", "breakfast"]
  },
  "plan": [
    {
      "id": "s1",
      "verb": "fetch",
      "tool": "HISTO_API",
      "params": {"loc": "Queenstown", "dates": ["2026-07-20", "2026-07-25"]},
      "timeout_ms": 8000
    },
    {
      "id": "s2",
      "verb": "predict",
      "tool": "PRC_EST",
      "params": {"method": "linear", "window": 7},
      "depends_on": ["s1"]
    },
    {
      "id": "s3",
      "verb": "filter",
      "tool": "BUD_MATCH",
      "params": {"max_price": 200, "amenities": ["breakfast"]},
      "depends_on": ["s2"]
    },
    {
      "id": "s4",
      "verb": "format",
      "tool": "PRESENT",
      "params": {"top": 3},
      "depends_on": ["s3"],
      "output_key": "hotel_options"
    }
  ],
  "out_fmt": "human",
  "state": "PENDING"
}
