{
  "proto_ver": "1.0.0",
  "msg_id": "retry-exp-001",
  "ts": "2026-05-09T00:00:00Z",
  "sender": "TEST_AGENT",
  "g": "RETRY_TEST",
  "plan": [
    {
      "id": "s1",
      "verb": "fetch",
      "tool": "FLAKY_TOOL",
      "params": {},
      "retry": {"max_attempts": 4, "backoff_ms": 100, "strategy": "exponential"},
      "on_error": "fail_fast"
    }
  ],
  "state": "PENDING"
}
